{
  "$schema": "http://json-schema.org/draft-07/schema#",
  "title": "Common Translation Schema",
  "type": "object",
  "properties": {
    "categories": {
      "type": "object",
      "additionalProperties": { "type": "string" }
    },
    "tags": {
      "type": "object",
      "additionalProperties": { "type": "string" }
    },
    "units": {
      "type": "object",
      "additionalProperties": { "type": "string" }
    },
    "interactions": {
      "type": "object",
      "additionalProperties": { "type": "string" }
    },
    "sources": {
      "type": "object",
      "additionalProperties": {
        "type": "object",
        "properties": {
          "license_description": { "type": "string" },
          "attribution": { "type": "string" }
        },
        "required": ["license_description", "attribution"],
        "additionalProperties": false
      }
    }
  },
  "required": ["categories", "tags", "units", "interactions", "sources"],
  "additionalProperties": false
}
