{
  "categories": {
    "vegetables": "Vegetables",
    "fruits": "Fruits",
    "herbs_spices": "Herbs & Spices",
    "oils_fats": "Oils & Fats",
    "fermented": "Fermented Foods",
    "dairy_eggs": "Dairy & Eggs",
    "meat_poultry": "Meat & Poultry",
    "nuts_seeds": "Nuts, Seeds & Legumes",
    "grains_bakery": "Grains & Bakery Products",
    "processed_prepared": "Prepared Foods & Processed Snacks",
    "other": "Other / Miscellaneous",
    "supplements_otc": "Supplements & OTC Medicines"
  },
  "tags": {
    "green_leaves": "Green Leafy Vegetables",
    "berries": "Berries",
    "herbs": "Herbs",
    "vegetable_oils": "Vegetable Oils",
    "fermented_soy": "Fermented Soy Products",
    "aged_cheese": "Aged Cheeses",
    "poultry": "Poultry",
    "nuts": "Nuts & Seeds",
    "raw": "Raw Foods",
    "cooked": "Cooked & Prepared Foods",
    "dairy": "Dairy Products",
    "meat": "Meat",
    "seafood": "Fish & Seafood",
    "beverages": "Beverages",
    "cruciferous": "Cruciferous Vegetables",
    "k1": "Vitamin K1 (Phylloquinone)",
    "k2": "Vitamin K2 (Menaquinones)",
    "fermented": "Fermented Foods",
    "seeds": "Seeds",
    "processed": "Processed & Prepared Foods",
    "soy": "Soy Products",
    "organ_meat": "Organ Meats",
    "egg": "Eggs",
    "fast_food": "Fast Food",
    "high_sodium": "High Sodium",
    "bakery": "Bakery Products",
    "legumes": "Legumes & Beans",
    "baby_food": "Baby Food & Formula",
    "chocolate": "Chocolate & Cocoa",
    "sweetened": "Sweetened / Added Sugar",
    "mushrooms": "Mushrooms",
    "affects_coagulation": "Affects blood clotting",
    "affects_warfarin": "Interacts with Warfarin"
  },
  "units": {
    "g": "grams (g)",
    "ml": "milliliters (ml)",
    "piece": "piece(s)",
    "cup": "cup(s)",
    "tbsp": "tablespoon(s) (tbsp)",
    "tsp": "teaspoon(s) (tsp)"
  },
  "interactions": {
    "decreases_efficacy": "Decreases Warfarin efficacy",
    "increases_bleeding_risk": "Increases bleeding risk",
    "anticoagulant": "Natural blood thinner (anticoagulant)",
    "procoagulant": "Promotes clotting (procoagulant)",
    "none": "No known clinical interaction",
    "mild": "Mild severity",
    "moderate": "Moderate severity",
    "high": "High severity",
    "warfarin_keep_consistent": "Maintain a consistent intake. Do not suddenly change your consumption level.",
    "warfarin_limit_excessive": "Limit excessive intake. Avoid sudden increases or decreases.",
    "warfarin_avoid": "Avoid completely during Warfarin therapy."
  },
  "sources": {
    "usda": {
      "license_description": "Public Domain / CC0 1.0 Universal",
      "attribution": "U.S. Department of Agriculture, Agricultural Research Service"
    },
    "ciqual": {
      "license_description": "Open Licence 2.0",
      "attribution": "Anses. Ciqual French food composition table."
    },
    "fda": {
      "license_description": "Public Domain / U.S. Government Work",
      "attribution": "Official drug labels published by the US Food and Drug Administration."
    },
    "stockley": {
      "license_description": "Copyrighted (Scientific Facts Referenced)",
      "attribution": "Stockley's Drug Interactions, Pharmaceutical Press."
    },
    "mskcc": {
      "license_description": "Copyrighted (Scientific Facts Referenced)",
      "attribution": "Memorial Sloan Kettering Cancer Center."
    },
    "nih": {
      "license_description": "Public Domain / U.S. Government Work",
      "attribution": "National Center for Complementary and Integrative Health."
    }
  }
}
